commit	strategy	summary_metric	topk_enrichment	ndcg	hypervolume	topk_feasible_frac	n_candidates	k	status	description
61c89f5	agent_improved	0.7167	0.7167	0.9733	0.5976	0.8000	533	20	discard	changed agent_improved to replace the consensus-shortlist rerank with a full-pool lexicographic ensemble ranked by exact oracle vote count, worst oracle rank, and mean oracle rank, with the learned ensemble only as a late tie-break
61c89f5	agent_improved	0.7000	0.7000	0.9664	0.5576	0.7500	533	20	discard	changed agent_improved to rank the full pool by exact heuristic-oracle top-20 vote tier with a per-oracle LambdaMART soft-min frontier score as the primary within-tier order, using the exact oracle frontier and threshold-gated scores as tie-breaks
61c89f5	agent_improved	0.7000	0.7000	0.9649	0.5976	0.8500	533	20	discard	changed agent_improved to rank the full pool by 3-oracle top-20 vote tier and a nonlinear product of threshold-gate, rank-product, Pareto, and a conservative top-k-aware MLP+LambdaMART percentile score
61c89f5	agent_improved	0.6667	0.6667	0.9917	0.5163	0.9000	533	20	discard	changed agent_improved to rank the full pool by a Copeland-style majority vote across threshold-gate, rank-product, Pareto, MLP, and LambdaMART signals, while retraining the learned models on a conservative min/geom/mean oracle target with tuned defaults
61c89f5	agent_improved	0.7167	0.7167	0.9718	0.5576	0.8500	533	20	discard	changed agent_improved to keep the current 2-of-3 consensus shortlist plus learned+Pareto filler selection, but rerank the final selected top-20 by direct LambdaMART score with threshold-gated and activity tie-breaks
61c89f5	agent_improved	0.7000	0.7000	0.9807	0.5576	0.8000	533	20	discard	changed agent_improved to keep the current 2-of-3 consensus shortlist and threshold-gated final rerank, but replace the learned+Pareto filler selection with a top-heavy conservative MLP trained on oracle scores
61c89f5	agent_improved	0.7167	0.7167	0.9677	0.5576	0.8500	533	20	discard	changed agent_improved to keep the current 2-of-3 consensus shortlist plus learned+Pareto filler selection, but prioritize exact heuristic top-20 vote count ahead of threshold-gated and learned scores when ordering the shortlist and final top-20
61c89f5	agent_improved	0.7167	0.7167	0.9804	0.5576	0.8500	533	20	discard	changed agent_improved to keep the current 2-of-3 consensus shortlist plus learned+Pareto filler selection, but rerank the final selected top-20 by threshold-gated score with a learned+rank-product+Pareto reciprocal-rank-fusion tie-break instead of learned score alone
61c89f5	agent_improved	0.3833	0.3833	0.8733	0.5108	0.9500	533	20	discard	changed agent_improved to hard-filter toxicity<=0.7 and dev_penalty<=3.0 before directly ranking survivors with a top-heavy LambdaMART model trained with lambdarank relevance labels
61c89f5	agent_improved	0.7167	0.7167	0.9805	0.5976	0.8500	533	20	keep	changed agent_improved to keep the current 2-of-3 consensus shortlist plus threshold-gated rerank, but augment the learned ensemble with a conservative per-oracle MLP trained to predict Pareto, rank-product, and threshold-gate scores separately
61c89f5	agent_improved	0.7167	0.7167	0.9810	0.5576	0.8500	533	20	keep	changed agent_improved to keep the current 2-of-3 consensus shortlist, but rerank the shortlist and final top-20 primarily by a conservative per-oracle MLP bottleneck score using min+harmonic aggregation of predicted Pareto/rank-product/threshold-gate scores instead of threshold-gated score alone
61c89f5	agent_improved	0.6667	0.6667	0.9906	0.5163	0.8500	533	20	discard	changed agent_improved to rank the full pool by a conservative learned ensemble trained on top-heavy shared-oracle top-k targets, fused with nonlinear threshold-gate, Pareto, and rank-product scores instead of the 2-of-3 consensus shortlist
61c89f5	agent_improved	0.7000	0.7000	0.9744	0.5576	0.8000	533	20	discard	changed agent_improved to keep the current 2-of-3 consensus shortlist, but rerank the shortlist and final top-20 with a top-heavy conservative LambdaMART trained on multi-oracle scores instead of the per-oracle MLP bottleneck reranker
61c89f5	agent_improved	0.7000	0.7000	0.9866	0.5976	0.8500	533	20	discard	changed agent_improved to keep the top-14 heuristic consensus core, but fill the rest of the top-20 by interleaving a direct MLP full-pool ranking trained on a top-k agreement plus composite oracle target
61c89f5	agent_improved	0.7167	0.7167	0.9809	0.5576	0.8500	533	20	discard	changed agent_improved to rerank the current 2-of-3 consensus shortlist and final top-20 by a conservative ensemble of per-oracle MLP and per-oracle LambdaMART scores instead of the per-oracle MLP alone
1389f02	agent_improved	0.6833	0.6833	0.9910	0.4763	0.9000	533	20	discard	changed agent_improved to rank the full pool directly with a top-heavy conservative MLP trained on oracle scores with weighted Huber loss instead of the heuristic 2-of-3 consensus shortlist reranker
1389f02	agent_improved	0.7167	0.7167	0.9804	0.5576	0.8500	533	20	discard	changed agent_improved to keep the current 2-of-3 consensus shortlist, but retrain the per-oracle MLP reranker with a top-heavy multitask weighted Huber loss that emphasizes candidates strong across all oracle heads instead of uniform regression
