commit	strategy	summary_metric	topk_enrichment	ndcg	hypervolume	topk_feasible_frac	n_candidates	k	status	description
3a41c14	agent_improved	0.6833	0.6833	0.9715	0.5853	0.7500	533	20	keep	baseline agent_improved
3a41c14	agent_improved	0.7000	0.7000	0.9735	0.5976	0.8000	533	20	keep	increased agent_improved weights to activity=0.50 toxicity=0.50 stability=0.30 while keeping dev_penalty=0.15
3a41c14	agent_improved	0.6667	0.6667	0.9757	0.5684	0.7500	533	20	discard	increased agent_improved stability weight from 0.30 to 0.35 while keeping activity=0.50 toxicity=0.50 and dev_penalty=0.15
29c21af	agent_improved	0.6833	0.6833	0.9790	0.5976	0.8000	533	20	discard	added toxicity<=0.7 and dev_penalty<=3 feasibility-first partition ahead of the current weighted agent_improved score
29c21af	agent_improved	0.7000	0.7000	0.9735	0.5976	0.8000	533	20	discard	added soft squared penalties above toxicity>0.7 and dev_penalty>3.0 on top of the current agent_improved weighted score
29c21af	agent_improved	0.6500	0.6500	0.9820	0.5737	0.8500	533	20	discard	added a 0.15 min(activity_norm, 1-toxicity_norm) activity-safety balance bonus on top of the current agent_improved weighted score
9d89adb	agent_improved	0.6500	0.6500	0.9593	0.5984	0.8500	533	20	discard	ranked agent_improved by Pareto fronts across activity/toxicity/stability/dev_penalty with the current weighted score as the within-front tie-break
9d89adb	agent_improved	0.6667	0.6667	0.9712	0.5853	0.7000	533	20	discard	added a 0.10 sqrt(activity_norm*stability_norm) activity-stability synergy bonus on top of the current agent_improved weighted score
7a90566	agent_improved	0.6667	0.6667	0.9844	0.5730	0.8000	533	20	discard	blended the current weighted agent_improved score with a 0.20 normalized threshold-gated activity-stability bonus using sigmoid toxicity and dev_penalty gates
7a90566	agent_improved	0.6833	0.6833	0.9730	0.5853	0.7500	533	20	discard	increased agent_improved dev_penalty weight from 0.15 to 0.20 while keeping activity=0.50 toxicity=0.50 and stability=0.30
a4e2bf7	agent_improved	0.7000	0.7000	0.9776	0.5976	0.8000	533	20	keep	changed agent_improved to keep the current weighted-sum top-20 shortlist and rerank that shortlist by a threshold-gated activity-stability score
06d74a6	agent_improved	0.6000	0.6000	0.9788	0.4641	0.7500	533	20	discard	replaced agent_improved's weighted-shortlist rerank with a LambdaMART model trained on nonlinear rank-aware and oracle-proxy endpoint features
06d74a6	agent_improved	0.6500	0.6500	0.9788	0.5587	0.8500	533	20	discard	replaced agent_improved with an MLP trained on oracle top-k agreement and nonlinear normalized endpoint interaction features
06d74a6	agent_improved	0.6667	0.6667	0.9908	0.4763	0.8500	533	20	discard	changed agent_improved to rerank the weighted-sum top-30 shortlist by an equal-weight ensemble of the threshold-gated score and a LambdaMART model trained on oracle-aligned nonlinear endpoint features
06d74a6	agent_improved	0.6833	0.6833	0.9677	0.5976	0.8000	533	20	discard	changed agent_improved to form a hard-constraint-aware weighted top-20 shortlist and rerank that shortlist with a top-heavy MLP trained on nonlinear endpoint interaction features
06d74a6	agent_improved	0.6667	0.6667	0.9786	0.5730	0.9500	533	20	discard	changed agent_improved to rerank the current weighted-sum top-40 shortlist with a multi-oracle LambdaMART ensemble trained on nonlinear endpoint features and per-oracle top-20/top-40 relevance labels
06d74a6	agent_improved	0.6833	0.6833	0.9909	0.4763	0.9000	533	20	discard	changed agent_improved to rank normalized toxicity/dev_penalty feasibility buckets by an equal-weight full-pool ensemble of threshold-gated, MLP, and LambdaMART scores trained on top-k-aware nonlinear endpoint features
06d74a6	agent_improved	0.6667	0.6667	0.9865	0.5163	0.8500	533	20	discard	changed agent_improved to use a full-pool LambdaMART ranker trained on multi-oracle top-k relevance labels and nonlinear endpoint interaction features
06d74a6	agent_improved	0.6167	0.6167	0.9675	0.5170	1.0000	533	20	discard	changed agent_improved to rank hard toxicity<0.5/dev_penalty<=3 feasibility buckets first and sort each bucket by rank-product score with threshold-gated activity-stability tie-breaks
06d74a6	agent_improved	0.6833	0.6833	0.9907	0.4763	0.9000	533	20	discard	changed agent_improved to expand the current weighted top-20 shortlist with LambdaMART top candidates on nonlinear endpoint features before reranking the union by the threshold-gated activity-stability score
06d74a6	agent_improved	0.6167	0.6167	0.9591	0.5186	0.8000	533	20	discard	changed agent_improved to use a full-pool LambdaMART ranker trained on nonlinear endpoint features and multi-oracle top-20/top-40 relevance labels
06d74a6	agent_improved	0.7000	0.7000	0.9778	0.5976	0.8000	533	20	keep	changed agent_improved to rerank the current weighted-sum top-20 shortlist by an equal-weight ensemble of the threshold-gated score and full-pool rank-product score
06d74a6	agent_improved	0.6167	0.6167	0.9769	0.4763	0.8500	533	20	discard	changed agent_improved to use a full-pool MLP ranker trained with top-heavy weighted Huber loss on oracle-aligned nonlinear interaction features
06d74a6	agent_improved	0.7000	0.7000	0.9249	0.5976	0.8000	533	20	discard	changed agent_improved to rerank the current weighted-sum top-20 shortlist by a harmonic-agreement ensemble of the threshold-gated/rank-product heuristic and an MLP trained on oracle-consensus top-20/top-40 targets from nonlinear endpoint features
06d74a6	agent_improved	0.6667	0.6667	0.9918	0.5163	0.9000	533	20	discard	changed agent_improved to rerank a weighted-sum/LambdaMART top-30 consensus-union shortlist by the threshold-gated and rank-product heuristic ensemble using nonlinear LambdaMART endpoint features
06d74a6	agent_improved	0.7000	0.7000	0.9791	0.5827	0.8500	533	20	keep	changed agent_improved to rank the union of the threshold-gated, rank-product, and Pareto top-20 shortlists by reciprocal-rank fusion
a488f0b	agent_improved	0.6833	0.6833	0.9904	0.5163	0.9500	533	20	discard	changed agent_improved to rerank the threshold-gated/rank-product/Pareto top-20 union shortlist by reciprocal-rank fusion of the current heuristic consensus and a consensus-target LambdaMART trained on nonlinear endpoint features
a488f0b	agent_improved	0.6667	0.6667	0.9582	0.5976	0.8500	533	20	discard	changed agent_improved to rank Pareto front layers first and rerank each front by reciprocal-rank fusion of the threshold-gated and rank-product scores
a488f0b	agent_improved	0.6500	0.6500	0.9818	0.5163	0.9000	533	20	discard	changed agent_improved to use a full-pool multitask MLP trained to predict pareto-rank/rank-product/threshold-gate oracle scores from nonlinear endpoint features and rank by their harmonic mean
a488f0b	agent_improved	0.6333	0.6333	0.9719	0.4763	0.8500	533	20	discard	changed agent_improved to rank normalized toxicity/dev-penalty feasibility buckets by an oracle-agreement LambdaMART trained on nonlinear endpoint features
a488f0b	agent_improved	0.6000	0.6000	0.9467	0.5163	1.0000	533	20	discard	changed agent_improved to use a full-pool LambdaMART ranker trained on top-heavy composite oracle targets from nonlinear rank-based endpoint features
a488f0b	agent_improved	0.7167	0.7167	0.9740	0.5976	0.8000	533	20	keep	changed agent_improved to prioritize candidates appearing in at least two of the threshold-gated, rank-product, and Pareto top-20 shortlists before ranking by reciprocal-rank fusion
a488f0b	agent_improved	0.7000	0.7000	0.9636	0.5976	0.8000	533	20	discard	changed agent_improved to add top-20 candidates from a nonlinear-feature MLP to the 2-of-3 consensus shortlist and rerank that pool by combined votes plus heuristic/MLP reciprocal-rank fusion
a488f0b	agent_improved	0.7167	0.7167	0.9631	0.5976	0.8000	533	20	discard	changed agent_improved to rank 3-of-3 heuristic consensus candidates ahead of 2-of-3 survivors and rerank each tier with a nonlinear-feature LambdaMART oracle model
a488f0b	agent_improved	0.7167	0.7167	0.9688	0.5976	0.8000	533	20	discard	changed agent_improved to rerank the current 2-of-3 heuristic consensus shortlist with a true LambdaMART trained on oracle-style nonlinear endpoint features while keeping reciprocal-rank fusion fallback unchanged
a488f0b	agent_improved	0.6167	0.6167	0.9773	0.5108	0.8500	533	20	discard	changed agent_improved to use a full-pool true LambdaMART ranker trained on top-heavy oracle-agreement relevance labels from nonlinear endpoint features
a488f0b	agent_improved	0.6333	0.6333	0.9809	0.4839	0.8500	533	20	discard	changed agent_improved to rerank the union of the hard-feasible fusion top-40 and the threshold-gated/rank-product/Pareto top-20 heuristic elites with a nonlinear-feature LambdaMART
35e74fe	agent_improved	0.7167	0.7167	0.9758	0.5576	0.7500	533	20	keep	changed agent_improved to rank candidates by the current 2-of-3 heuristic consensus flag, then LambdaMART oracle score, with reciprocal-rank fusion as tie-break
35e74fe	agent_improved	0.7000	0.7000	0.9607	0.5976	0.8000	533	20	discard	changed agent_improved to rank candidates by the current 2-of-3 heuristic consensus flag, then a top-heavy oracle-trained MLP on nonlinear endpoint/feasibility features, with reciprocal-rank fusion as tie-break
35e74fe	agent_improved	0.7167	0.7167	0.9720	0.5976	0.8500	533	20	discard	changed agent_improved to rank 2-of-3 heuristic consensus candidates first, then hard-feasible candidates, then an oracle-trained MLP+LambdaMART ensemble on nonlinear endpoint features, with heuristic reciprocal-rank fusion as tie-break
35e74fe	agent_improved	0.7167	0.7167	0.9788	0.5976	0.8500	533	20	keep	changed agent_improved to rerank 2-of-3 heuristic consensus candidates by reciprocal-rank fusion of LambdaMART, threshold-gated, rank-product, and Pareto scores, with LambdaMART as tie-break
35e74fe	agent_improved	0.6667	0.6667	0.9918	0.5163	0.9000	533	20	discard	changed agent_improved to rank by geometric agreement of an engineered-feature LambdaMART and the threshold-gated/rank-product/Pareto scores
35e74fe	agent_improved	0.6500	0.6500	0.9863	0.5170	0.9000	533	20	discard	changed agent_improved to rank normalized-feasible candidates first, then an engineered-feature oracle-trained MLP+LambdaMART ensemble, with bottleneck and threshold-gate tie-breaks
35e74fe	agent_improved	0.7167	0.7167	0.9752	0.5976	0.8000	533	20	discard	changed agent_improved to rerank 2-of-3 heuristic consensus candidates with a pairwise MLP trained on oracle top-20 consensus targets from engineered endpoint features, with heuristic reciprocal-rank fusion fallback unchanged
35e74fe	agent_improved	0.7167	0.7167	0.9663	0.5976	0.8500	533	20	discard	changed agent_improved to rank 2-of-3 heuristic consensus candidates by multiscale top-20/top-40 agreement across threshold-gated, rank-product, Pareto, and a tuned LambdaMART score, with reciprocal-rank fusion as tie-break
35e74fe	agent_improved	0.6500	0.6500	0.9700	0.5827	0.9000	533	20	discard	changed agent_improved to rank the full pool with a tuned oracle-trained MLP on engineered nonlinear endpoint features and a top-heavy weighted loss
35e74fe	agent_improved	0.7000	0.7000	0.9712	0.5576	0.8000	533	20	discard	changed agent_improved to rank the 2-of-3 heuristic consensus shortlist by a LambdaMART trained on engineered feasibility/bottleneck features and a geometric-mean-plus-min oracle consensus target, with heuristic fusion as tie-break
6dad72c	agent_improved	0.6500	0.6500	0.9854	0.5163	0.9000	533	20	discard	changed agent_improved to rank normalized toxicity/developability-feasible candidates first with an engineered-feature top-heavy LambdaMART, then order the remainder by threshold-gated score
6dad72c	agent_improved	0.5833	0.5833	0.9749	0.5170	0.8000	533	20	discard	changed agent_improved to prioritize candidates jointly supported by engineered-feature oracle-trained MLP and LambdaMART top-40 ranks under toxicity/dev_penalty quantile filters, then rank that shortlist by a harmonic bottleneck score with learned/heuristic fusion fallback
6dad72c	agent_improved	0.5833	0.5833	0.9860	0.4584	0.9000	533	20	discard	changed agent_improved to rank the full pool by a bottleneck-aware MLP+LambdaMART ensemble on engineered nonlinear endpoint features, with heuristic reciprocal-rank fusion as tie-break
6dad72c	agent_improved	0.3667	0.3667	0.8299	0.3932	0.9500	533	20	discard	changed agent_improved to rerank the union of threshold-gate-pass and 2-of-3 heuristic-consensus candidates with a true LambdaMART ranker on oracle-inspired nonlinear features, then fall back to heuristic fusion
6dad72c	agent_improved	0.7000	0.7000	0.9794	0.5576	0.8500	533	20	discard	changed agent_improved to rerank 2-of-3 heuristic consensus candidates by reciprocal-rank fusion of threshold-gated, rank-product, Pareto, and an engineered-feature top-heavy LambdaMART order, with the LambdaMART order as tie-break
6dad72c	agent_improved	0.6667	0.6667	0.9390	0.5576	0.8500	533	20	discard	changed agent_improved to keep the 2-of-3 heuristic consensus filter, but rerank candidates by a relevance-binned LambdaMART trained on engineered bottleneck and feasibility features with oracle percentile targets
6dad72c	agent_improved	0.6667	0.6667	0.9877	0.5163	0.8500	533	20	discard	changed agent_improved to rank the full pool directly with the oracle-trained LambdaMART model instead of consensus-shortlist heuristic fusion
6dad72c	agent_improved	0.6667	0.6667	0.9817	0.5730	0.8500	533	20	discard	changed agent_improved to rank the full pool with a true LambdaMART ranker trained on duplicated per-oracle relevance labels from engineered nonlinear endpoint features, with heuristic consensus fallback if unavailable
6dad72c	agent_improved	0.6000	0.6000	0.9792	0.4839	0.9500	533	20	discard	changed agent_improved to rank the full pool directly with a tail-focused oracle-trained MLP on heuristic meta-features and nonlinear endpoint interactions
6dad72c	agent_improved	0.7000	0.7000	0.9640	0.5976	0.8500	533	20	discard	changed agent_improved to rank lexicographically by exact 3-oracle top-20 vote count, then threshold feasibility, top-40 vote count, and worst-oracle percentile support
6dad72c	agent_improved	0.7000	0.7000	0.9792	0.5976	0.8500	533	20	discard	changed agent_improved to rerank 2-of-3 heuristic consensus candidates by reciprocal-rank fusion of threshold-gated, rank-product, Pareto, and a per-oracle LambdaMART ensemble scored by 0.6*min+0.4*mean predicted oracle support, with the learned score as tie-break
6dad72c	agent_improved	0.7000	0.7000	0.9779	0.5976	0.8500	533	20	discard	changed agent_improved to keep the current 2-of-3 heuristic consensus plus reciprocal-rank fusion, but replace the raw-endpoint LambdaMART score with an engineered-feature LambdaMART trained on a geometric-mean oracle-agreement target
6dad72c	agent_improved	0.7000	0.7000	0.9686	0.5976	0.8500	533	20	discard	changed agent_improved to keep the current 2-of-3 heuristic consensus fusion, but train the LambdaMART tie-break on oracle top-20 agreement count plus top-40 support instead of mean oracle score
6dad72c	agent_improved	0.7167	0.7167	0.9799	0.5576	0.8500	533	20	keep	changed agent_improved to rerank the 2-of-3 heuristic consensus shortlist by threshold-gated score and fill the remaining positions by reciprocal-rank fusion of the engineered-feature MLP+LambdaMART ensemble with the Pareto score
6dad72c	agent_improved	0.7167	0.7167	0.9677	0.5576	0.8500	533	20	discard	changed agent_improved to rerank the 2-of-3 heuristic consensus shortlist by vote tier and a geometric-mean consensus of threshold-gated, rank-product, Pareto, and learned-ensemble scores, with the remaining pool still filled by learned-ensemble+Pareto fusion
6dad72c	agent_improved	0.5667	0.5667	0.9718	0.4603	0.8000	533	20	discard	changed agent_improved to rank directly with a tuned engineered-feature LambdaMART model instead of the heuristic consensus shortlist, keeping the old consensus fusion only as fallback
6dad72c	agent_improved	0.5833	0.5833	0.9811	0.4603	0.8000	533	20	discard	changed agent_improved to rank the full pool by a feasibility-gated LambdaMART score trained on a bottleneck-heavy oracle target with added percentile and constraint-shortfall features
6dad72c	agent_improved	0.7167	0.7167	0.9804	0.5576	0.8500	533	20	keep	changed agent_improved to keep the current 2-of-3 consensus shortlist plus learned+Pareto filler selection, but rerank the final selected top-20 by threshold-gated score with learned-ensemble and activity tie-breaks
61c89f5	agent_improved	0.6833	0.6833	0.9906	0.5163	0.9500	533	20	discard	changed agent_improved to choose the top-20 from the union of the 2-of-3 heuristic consensus shortlist and hard-feasible candidates ranked by a per-oracle MLP+LambdaMART soft-min ensemble, with the union reranked by threshold-gated score and the tail by learned+Pareto+rank-product fusion
61c89f5	agent_improved	0.6333	0.6333	0.9897	0.4763	0.8500	533	20	discard	changed agent_improved to filter to the top 3k threshold-gated candidates, then rank that block with a per-oracle MLP+LambdaMART soft-min ensemble trained on normalized oracle scores with added gate and shortfall features, leaving the tail in threshold-gate order
61c89f5	agent_improved	0.7000	0.7000	0.9681	0.5576	0.8000	533	20	discard	changed agent_improved to rank by exact oracle top-20 vote count and use a multitask oracle-trained MLP as the tie-break within vote tiers
61c89f5	agent_improved	0.6333	0.6333	0.9894	0.4763	0.8500	533	20	discard	changed agent_improved to build the final top-20 from the union of the top-40 threshold-gated, rank-product, Pareto, and learned-ensemble shortlists, reranking that union by maximin consensus with vote and fusion tie-breaks
61c89f5	agent_improved	0.7000	0.7000	0.9791	0.5827	0.8500	533	20	discard	changed agent_improved to rerank the existing 2-of-3 heuristic consensus shortlist with an MLP trained on oracle top-20 consensus labels plus shortfall features, replacing the previous learned ensemble and keeping Pareto-based filler selection
61c89f5	agent_improved	0.6000	0.6000	0.9872	0.5163	1.0000	533	20	discard	changed agent_improved to rank hard-feasible candidates ahead of the rest with a direct conservative MLP trained on composite oracle scores and pairwise ranking loss, replacing the heuristic consensus shortlist
61c89f5	agent_improved	0.6333	0.6333	0.9896	0.4763	0.8500	533	20	discard	changed agent_improved to expand the 2-of-3 consensus shortlist into a top-60 oracle-fusion pool, rank that pool with a top-heavy conservative LambdaMART reranker, and rerank the selected top-20 by threshold-gated score
61c89f5	agent_improved	0.6333	0.6333	0.9879	0.4763	0.8500	533	20	discard	changed agent_improved to rank hard-feasible candidates ahead of the rest and sort each tier by the oracle-trained MLP+LambdaMART ensemble, with learned+gate+Pareto tie-breaks
61c89f5	agent_improved	0.6167	0.6167	0.9845	0.4839	0.8500	533	20	discard	changed agent_improved to rank the full pool with a LambdaMART model trained on graded oracle top-k consensus labels, replacing the heuristic consensus shortlist
61c89f5	agent_improved	0.6667	0.6667	0.9900	0.4763	0.8500	533	20	discard	changed agent_improved to add the oracle-trained learned ensemble as a fourth top-20 voter when building the consensus shortlist, while keeping the current threshold-gated rerank and learned+Pareto filler structure
61c89f5	agent_improved	0.7167	0.7167	0.9675	0.5976	0.8500	533	20	discard	changed agent_improved to rerank the current 2-of-3 consensus shortlist by exact vote tier and a conservative score-space MLP+LambdaMART ensemble trained on added shortfall/log features, with the tail still filled by learned+Pareto fusion
61c89f5	agent_improved	0.7000	0.7000	0.9671	0.5576	0.7500	533	20	discard	changed agent_improved to keep the 2-of-3 consensus shortlist, but fill the remaining slots from a mild-feasibility tier ranked by a top-k-aware LambdaMART trained on added feasibility-margin and bottleneck features, then rerank the final top-20 by threshold-gated score
61c89f5	agent_improved	0.6167	0.6167	0.9814	0.5186	0.8000	533	20	discard	changed agent_improved to replace the heuristic consensus shortlist with a true LambdaMART ranker trained on top-heavy oracle-vote relevance labels and added shortfall features, keeping the current consensus policy only as a failure fallback
61c89f5	agent_improved	0.6333	0.6333	0.9743	0.4763	0.8500	533	20	discard	changed agent_improved to rank the full pool directly with a LambdaMART model trained on added heuristic vote/meta-features and a top-k-aware composite oracle target
61c89f5	agent_improved	0.6333	0.6333	0.9896	0.4763	0.8500	533	20	discard	changed agent_improved to rank hard-feasible candidates ahead of the rest and sort the full pool by a per-oracle MLP+LambdaMART harmonic ensemble trained on oracle scores, with gate/rank-product/Pareto tie-breaks
61c89f5	agent_improved	0.4333	0.4333	0.9478	0.4416	0.8000	533	20	discard	changed agent_improved to build the top-20 from an 80/20 mix of hard-feasible and global balanced rankings, ordered by bottleneck, harmonic, rank-product, Pareto, and gate scores
61c89f5	agent_improved	0.7000	0.7000	0.9803	0.5976	0.8500	533	20	discard	changed agent_improved to keep the current 2-of-3 consensus shortlist, rerank it with a per-oracle LambdaMART trained on oracle-aligned meta-features, and fill remaining slots from hard-feasible candidates before a learned+fusion reserve
61c89f5	agent_improved	0.6667	0.6667	0.9867	0.5163	0.9000	533	20	discard	changed agent_improved to replace the heuristic consensus shortlist with a threshold-gated feasible-first full-pool ranking fused from per-oracle LambdaMART models trained on the three evaluation oracle scores and added threshold-margin features
